isNull,original,translated,back_translated
False,▁ ကာ ပန် တ ရီ ယာ ပင်လယ် ကွေ့ ▁ ၌ ▁ မည် း မှောင် ▁ပြီး ▁ပြ န့် ကြ ဲ လျ ှ က် ▁တွေ့ရှိ ခဲ့သော ▁ မှောင် ခို သင်္ဘော ▁ရေ နံ တင် သင်္ဘော ▁ ဂျီ အ န်း ဆန် ▁ကိုင်တွယ် မှု ▁ အပေါ် ▁မတ်လ ▁၂ ၈ ရက် ▁နှင့် ▁၂ ၉ ရက် ▁တွင် ▁သြစတြေးလျ ▁လွှတ်တော် ▁ ၌ ▁ပြုလုပ်ခဲ့ သော ▁အစိုးရ ▁၏ ▁ ဂျီ အ န်း ဆန် ▁ ရေး ရာ ▁ ကြိုးပမ်းအားထုတ် မှုများ ▁သို့ ▁ ဝေဖန် မှုများ ▁ဦးတည် စေခဲ့သည်။,ကာ ပန် တ ရီ ယာ ပင်လယ် ကွေ့ ၌ မည် း မှောင် ပြီး ပြ န့် ကြ ဲ လျ ှ က် တွေ့ရှိ ခဲ့သော မှောင် ခို သင်္ဘော ရေ နံ တင် သင်္ဘော ဂျီ အ န်း ဆန် ကိုင်တွယ် မှု,သင်္ဘော ဂျီ အ န်း ဆန် ကိုင်တွယ် မှု
False,▁ အထက် လွှတ်တော်အမတ် ▁ ဂျ ိုး လူ း ၀တ် ▁( ▁အလုပ်သမား ရေး ရာ ▁၊ ▁ ကွင်း စ လန် ▁ ) ▁က ▁တရား ရေး ဝန်ကြီး ▁နှင့် ▁အ ကောက် ခွန် ▁ အထက် လွှတ်တော်အမတ် ▁ချ ရစ် ▁အ ယ် လစ် ဆန် ▁အား ▁သြစတြေးလျ ▁အစိုးရ ▁ ပိုင် နက် ▁တွင် ▁ “ ▁ဤ ▁အခြေအနေ များ ▁တွင် ▁ သင်္ဘော ▁ တစ်စီး ▁အား ▁ဖမ်းဆီး ▁ ရန် ▁ ေ ၀ ဟ င် ▁နှင့် ▁ရေ ကြောင်း ▁စောင့်ကြည့် မှု ▁နှင့် ▁ထို အလုပ် မှာ ▁ပြီး ဆုံး ခဲ့ကြောင်း ▁” ▁ကို ▁သ ရုပ် ပြ ခဲ့ ▁ သည့် ▁ ဂျီ အ န်း ဆန် ▁ရှာဖွေ မှု ▁နှင့် ▁ပတ်သက်၍ ▁မနေ့က ▁သူ ▁ပြုလုပ်ခဲ့ သည် ▁ဆို သော ▁သူ၏ ▁တောင်းဆို ချက် ▁အတွက် ▁သူ ▁ ရပ်တည် ခြင်း ▁ ရှိမရှိ ▁ကို ▁မေးခွန်း ▁မေး ချိန် ▁တွင် ▁မေး ခဲ့ပြီး ▁အစိုးရ ▁က ▁သြစတြေးလျ ▁ရေ ကြောင်း ▁သို့ ▁ ၀င် ရောက် ခဲ့ ▁ ပြီးနောက် ▁ သင်္ဘော ▁ကို ▁ဖမ်းဆီး ▁ ရန် ▁ ကိစ္စ ▁အား ▁မည်သည့် အတွက် ကြောင့် ▁အချိန် ▁နှစ် ▁ ပတ် ▁ယူ ခဲ့သည် ▁ကို ▁မေး ခဲ့သည် ▁။,အထက် လွှတ်တော်အမတ် ဂျ ိုး လူ း ၀တ် ( အလုပ်သမား ရေး ရာ ၊ ကွင်း စ လန် ) က တရား ရေး ဝန်ကြီး နှင့် အ ကောက် ခွန် အထက် လွှတ်တော်အမတ် ချ ရစ် အ ယ် လစ် ဆန် အား သြစတြေးလျ အစိုးရ ပိုင် နက် တွင် “ ဤ အခြေအနေ များ တွင် သင်္ဘော တစ်စီး အား ဖမ်းဆီး ရန် ေ ၀ ဟ င် နှင့် ရေ ကြောင်း စောင့်ကြည့် မှု နှင့် ထို အလုပ် မှာ ပြီး ဆုံး ခဲ့ကြောင်း ” ကို သ ရုပ် ပြ ခဲ့ သည့် ဂျီ အ န်း ဆန် ရှာဖွေ မှု နှင့် ပတ်သက်၍ မနေ့က သူ ပြုလုပ်ခဲ့ သည် ဆို သော သူ၏ တောင်းဆို ချက် အတွက် သူ ရပ်တည် ခြင်း ရှိမရှိ ကို မေးခွန်း မေး ချိန် တွင် မေး ခဲ့ပြီး အစိုးရ က သြစတြေးလျ ရေ ကြောင်း သို့ ၀င် ရောက် ,ဂျီ အ န်း ဆန် ရှာဖွေ မှု နှင့် ပတ်သက်၍ သြစတြေးလျ အစိုးရ က သြစတြေးလျ ရေ ကြောင်း သို့ ၀င် ရောက်
False,▁ အထက် လွှတ်တော်အမတ် ▁အ ယ် လစ် ဆန် ▁သည် ▁မတ်လ ▁ ၈ ▁ရက် နေ့ ▁တွင် ▁ င်္ သဘော ▁၏ ▁ပထမဆုံး ▁ရှာဖွေ ခြင်း ▁ ၌ ▁ “ ▁တရား မ ၀င် သည့် ▁မည်သည့်အရာ မှ ▁မလုပ် ခဲ့ ပါ ▁” ▁ဟု ▁ တု န့် ပြန် ခဲ့ပြီး ▁ “ ▁၁ ၇ ▁ရက် ▁ လုံး ▁ မျော နေ ခဲ့သည် ▁လို့ ▁ထို သို့ ▁ ဖော်ပြထား ခြင်း ▁မရှိ ▁” ▁ဟု ▁ ပြောဆို ၍ ▁အ တိုက် အ ခံ ▁၏ ▁ င်္ သဘော ▁သည် ▁တစ် ဆ ယ ့် ခု နှစ် ▁ရက် ကြာ ▁ မျော နေ ခဲ့သည် ▁ဆို သော ▁ ပြောဆို ချက် ▁ကို ▁ ဝေဖန် ခဲ့သည် ▁။,အထက် လွှတ်တော်အမတ် အ ယ် လစ် ဆန် သည် မတ်လ ၈ ရက် နေ့ တွင် င်္ သဘော ၏ ပထမဆုံး ရှာဖွေ ခြင်း ၌ “ တရား မ ၀င် သည့် မည်သည့်အရာ မှ မလုပ် ခဲ့ ပါ ” ဟု တု န့် ပြန် ခဲ့ပြီး “ ၁ ၇ ရက် လုံး မျော နေ ခဲ့သည် လို့ ထို သို့ ဖော်ပြထား ခြင်း မရှိ ” ဟု ပြောဆို ၍ အ တိုက် အ ခံ ၏ င်္ သဘော သည် တစ် ဆ ယ ့် ခု နှစ် ရက် ကြာ မျော နေ ခဲ့သည် ဆို သော ပြောဆို ချက် ကို ဝေဖန် ခဲ့သည် ။,အထက် လွှတ်တော်အမတ် အ ယ် လစ် ဆန် သည် မတ်လ ၈ ရက် နေ့ တွင် င်္ သဘော ၏ ပထမဆုံး ရှာဖွေ ခြင်း ၌ “ တရား မ ၀င် သည့် မည်သည့်အရာ မှ မလုပ် ခဲ့ ပါ ” ဟု တု န့် ပြန် ခဲ့ပြီး “ ၁ ၇ ရက် လုံး မျော နေ ခဲ့သည် လို့ ထို သို့ ဖော်ပြထား ခြင်း မရှိ ” ဟု ပြောဆို ၍ အ တိုက် အ ခံ ၏ င်္ သဘော သည် တစ် ဆ ယ ့် ခု နှစ် ရက် ကြာ မျော နေ ခဲ့သည် ဆို သော ပြောဆို ချက် ကို ဝေဖန် ခဲ့သည် ။
False,▁လူ း ဝတ် ▁က ▁ဆက်လက် ▁မှတ်ချက် ပြု ခဲ့သည် ▁မှာ ▁ င်္ သဘော ▁အား ▁အမှတ်အသားပြု ခဲ့သည် ▁မှာ ▁အ ကောက် ခွန် ▁ မဟုတ် ခဲ့ကြောင်း ▁၊ ▁သို့သော် ▁ “ ▁သြစတြေးလျ ▁ ကုန် တင် ▁ င်္ သဘော ▁ဖြတ်သန်း ခြင်း ▁တစ်ခု သာ ▁ ဖြစ်ကြောင်း ▁” ▁၊ ▁သို့ ရာတွင် ▁အ ယ် လစ် ဆန် ▁သည် ▁လူ း ဝတ် ▁၏ ▁ “ ▁ စီး ပွ ာ ဖြစ် ▁ရေ ယာဉ် များ ▁သြစတြေးလျ ▁အတွက် ▁ရှာဖွေ ခြင်း ▁တွင် ▁လုံးဝ ▁အ ခွင့် ▁မရှိ သည် ▁ကို ▁ စဉ်းစား ပါ ▁” ▁ဆို သည့် ▁တင်ပြ ခြင်း ▁ ကိစ္စ ▁ကို ▁ခုခံကာကွယ် ခဲ့ ▁ပြီး ▁အ ယ် လစ် ဆန် ▁က ▁ “ ▁ကျွန်တော်တို့ ၏ ▁အရေးပေါ် ▁အစီရင်ခံစာ များ ▁ အပေါ် ▁အား ထား ▁ပြီး မှ ▁ ထွက် ပါ ▁၊ ▁ င်္ သဘော ▁ကို ▁ ရှာ ပါ ▁” ▁ဟု ▁ဆို ခဲ့သည် ▁။,လူ း ဝတ် က ဆက်လက် မှတ်ချက် ပြု ခဲ့သည် မှာ င်္ သဘော အား အမှတ်အသားပြု ခဲ့သည် မှာ အ ကောက် ခွန် မဟုတ် ခဲ့ကြောင်း ၊ သို့သော် “ သြစတြေးလျ ကုန် တင် င်္ သဘော ဖြတ်သန်း ခြင်း တစ်ခု သာ ဖြစ်ကြောင်း ” ၊ သို့ ရာတွင် အ ယ် လစ် ဆန် သည် လူ း ဝတ် ၏ “ စီး ပွ ာ ဖြစ် ရေ ယာဉ် များ သြစတြေးလျ အတွက် ရှာဖွေ ခြင်း တွင် လုံးဝ အ ခွင့် မရှိ သည် ကို စဉ်းစား ပါ ” ဆို သည့် တင်ပြ ခြင်း ကိစ္စ ကို ခုခံကာကွယ် ခဲ့ ပြီး အ ယ် လစ် ဆန် က “ ကျွန်တော်တို့ ၏ အရေးပေါ် အစီရင်ခံစာ များ အပေါ် အား ထား ပြီး မှ ထွက် ပါ ၊ င်္ သဘော ကို ရှာ ပါ ” ဟု ဆို ခဲ့သည် ။,လူ း ဝတ် က ဆက်လက် မှတ်ချက် ပြု ခဲ့သည် မှာ င်္ သဘော အား အမှတ်အသားပြု ခဲ့သည် မှာ အ ကောက် ခွန် မဟုတ် ခဲ့ကြောင်း ၊ သို့သော် “ သြစတြေးလျ ကုန် တင် င်္ သဘော ဖြတ်သန်း ခြင်း တစ်ခု သာ ဖြစ်ကြောင်း ” ၊ သို့ ရာတွင် အ ယ် လစ် ဆန် သည် လူ း ဝတ် ၏ “ စီး ပွ ာ ဖြစ် ရေ ယာဉ် များ သြစတြေးလျ အတွက် ရှာဖွေ ခြင်း တွင် လုံးဝ အ ခွင့် မရှိ သည် ကို စဉ်းစား ပါ ” ဆို သည့် တင်ပြ ခြင်း ကိစ္စ ကို ခုခံကာကွယ် ခဲ့ ပြီး အ ယ် လစ် ဆန် က “ ကျွန်တော်တို့ ၏ အရေးပေါ် အစီရင်ခံစာ များ အပေါ် အား ထား ပြီး မှ ထွက် ပါ ၊ င်္ သဘော ကို ရှာ ပါ ” ဟု ဆို ခဲ့သည် ။
False,▁နောက်ပိုင်းတွင် ▁ အထက် လွှတ်တော်အမတ် ▁ ကယ် ရီ ▁အို ဘ ရ ိုင် ရန် ▁( ▁အလုပ်သမား ရေး ရာ ▁၊ ▁ တပ် စ် မေး နီးယား ▁ ) ▁က ▁ ကမ်းရိုးတန်း ▁ကာကွယ်ရေး ▁အစိုးရ ▁၏ ▁အကောင်အထည်ဖော် မှု ▁ကို ▁ ဝေဖန် ခဲ့ ▁ပြီး ▁ “ ▁ဒါ ▁က ▁လိမ်ညာ ခဲ့တာ ပဲ ▁၊ ▁ပြီးတော့ ▁မသိ နိုင်တဲ့ ▁သဘာဝပတ်ဝန်းကျင် ▁နဲ့ ▁ တာ း ဆီ း ထားတဲ့ ▁စွန့်စား မှုများ ▁ လည်း ▁ဆက် ပြီး ▁လိမ်ညာ နေတုန်း ပဲ ▁” ▁နှင့် ▁ “ ဂျီ အ န်း ဆန် ▁က ▁ ဝီ ပ ▁ ဆိပ်ကမ်း ▁ကို ▁ဝင်ရောက် ခွင့် ▁ ငြင်း ဆန် ခံခဲ့ရ တယ် ▁၊ ▁ဒါဟာ ▁တစ်စုံတစ်ခု ▁ကို ▁တိုက်ရိုက် ▁သယ်ဆောင် လာ တာ ▁ဖြစ်နိုင် တယ် ▁” ▁ဟု ▁ ပြောဆို ရင်း ▁တ ဆ ယ ့် ခု နှစ် ▁ရက် ▁ တိုင် ▁ င်္ သဘော ▁အား ▁ လျစ်လျူရှု ထား ခြင်း ▁၏ ▁ အန္တရာယ်များ ▁ကို ▁မီး မောင်း ထိုး ပြ ခဲ့သည် ▁။,နောက်ပိုင်းတွင် အထက် လွှတ်တော်အမတ် ကယ် ရီ အို ဘ ရ ိုင် ရန် ( အလုပ်သမား ရေး ရာ ၊ တပ် စ် မေး နီးယား ) က ကမ်းရိုးတန်း ကာကွယ်ရေး အစိုးရ ၏ အကောင်အထည်ဖော် မှု ကို ဝေဖန် ခဲ့ ပြီး “ ဒါ က လိမ်ညာ ခဲ့တာ ပဲ ၊ ပြီးတော့ မသိ နိုင်တဲ့ သဘာဝပတ်ဝန်းကျင် နဲ့ တာ း ဆီ း ထားတဲ့ စွန့်စား မှုများ လည်း ဆက် ပြီး လိမ်ညာ နေတုန်း ပဲ ” နှင့် “ ဂျီ အ န်း ဆန် က ဝီ ပ ဆိပ်ကမ်း ကို ဝင်ရောက် ခွင့် ငြင်း ဆန် ခံခဲ့ရ တယ် ၊ ဒါဟာ တစ်စုံတစ်ခု ကို တိုက်ရိုက် သယ်ဆောင် လာ တာ ဖြစ်နိုင် တယ် ” ဟု ပြောဆို ရင်း တ ဆ ယ ့် ခု နှစ် ရက် တိုင် င်္ သဘော အား လျစ်လျူရှု,နောက်ပိုင်းတွင် အထက် လွှတ်တော်အမတ် ကယ် ရီ အို ဘ ရ ိုင် ရန် ( အလုပ်သမား ရေး ရာ ၊ တပ် စ် မေး နီးယား ) က ကမ်းရိုးတန်း ကာကွယ်ရေး အစိုးရ ၏ အကောင်အထည်ဖော် မှု ကို ဝေဖန် ခဲ့ ပြီး “ ဒါ က လိမ်ညာ ခဲ့တာ ပဲ ၊ ပြီးတော့ မသိ နိုင်တဲ့ သဘာဝပတ်ဝန်းကျင် နဲ့ တာ း ဆီ း ထားတဲ့ စွန့်စား မှုများ လည်း ဆက် ပြီး လိမ်ညာ နေတုန်း ပဲ ” နှင့် “ ဂျီ အ န်း ဆန် က ဝီ ပ ဆိပ်ကမ်း ကို ဝင်ရောက် ခွင့် ငြင်း ဆန် ခံခဲ့ရ တယ် ၊ ဒါဟာ တစ်စုံတစ်ခု ကို တိုက်ရိုက် သယ်ဆောင် လာ တာ ဖြစ်နိုင် တယ် ” ဟု ပြောဆို ရင်း တ ဆ ယ ့် ခု နှစ် ရက် တိုင် င်္ သဘော အား လျစ်လျူရှု
False,▁ အထက် လွှတ်တော်အမတ် ▁ဒ ေး ဗ စ် ▁ဂျွန် စ တန် ▁( ▁လစ်ဘရယ် ▁၊ ▁အနောက် ▁သြစတြေးလျ ▁ ) ▁က ▁ ဂျီ အ န်း ဆန် ▁ကို ▁တွေ့ရှိ ခဲ့သော ▁နေရာ ▁တွင် ▁မည်သည့် ▁ င်္ သဘော နှင့် ဆိုင် သော ▁လမ်းကြောင်း များ ▁မှ ▁မရှိ ကြောင်း ▁နှင့် ▁အ ပျက် အ ဆီ း မရှိသော ▁ င်္ သဘော ▁ တစ်စီး ▁သို့ ▁ပေးအပ် ထားသော ▁ အရင်းအမြစ် များ ▁သည် ▁အခြားနေရာများ ▁တွင် ▁ ကမ်းရိုးတန်း ▁ကာကွယ်ရေး ▁ ၌ ▁ ကွာ ဟ ချက် များ ▁ထားခဲ့ ကြောင်း ▁ငြင်းခုံ သွား ခဲ့သည် ▁။,အထက် လွှတ်တော်အမတ် ဒ ေး ဗ စ် ဂျွန် စ တန် ( လစ်ဘရယ် ၊ အနောက် သြစတြေးလျ ) က ဂျီ အ န်း ဆန် ကို တွေ့ရှိ ခဲ့သော နေရာ တွင် မည်သည့် င်္ သဘော နှင့် ဆိုင် သော လမ်းကြောင်း များ မှ မရှိ ကြောင်း နှင့် အ ပျက် အ ဆီ း မရှိသော င်္ သဘော တစ်စီး သို့ ပေးအပ် ထားသော အရင်းအမြစ် များ သည် အခြားနေရာများ တွင် ကမ်းရိုးတန်း ကာကွယ်ရေး ၌ ကွာ ဟ ချက် များ ထားခဲ့ ကြောင်း ငြင်းခုံ သွား ခဲ့သည် ။,အထက် လွှတ်တော်အမတ် ဒ ေး ဗ စ် ဂျွန် စ တန် ( လစ်ဘရယ် ၊ အနောက် သြစတြေးလျ ) က ဂျီ အ န်း ဆန် ကို တွေ့ရှိ ခဲ့သော နေရာ တွင် မည်သည့် င်္ သဘော နှင့် ဆိုင် သော လမ်းကြောင်း များ မှ မရှိ ကြောင်း နှင့် အ ပျက် အ ဆီ း မရှိသော င်္ သဘော တစ်စီး သို့ ပေးအပ် ထားသော အရင်းအမြစ် များ သည် အခြားနေရာများ တွင် ကမ်းရိုးတန်း ကာကွယ်ရေး ၌ ကွာ ဟ ချက် များ ထားခဲ့ ကြောင်း ငြင်းခုံ သွား ခဲ့သည် ။
False,▁ဒေသခံ ▁ရဲ တွေ ▁အဆိုအရ ▁ ဇ ူ လို င် ▁၃ ၁ ▁ရက် နေ့ ▁ တနင်္ဂနွေ နေ့ ▁မှာ ▁လူသတ်မှု ▁ ဖြစ်ပွား ခဲ့တာ ▁ဖြစ်နိုင် ▁ပြီး ▁အနည်းဆုံး ▁သံသယ ရှိ သူ ▁၁၀ ▁ ယောက် ▁ကို ▁ မေးမြန်း ပြီး ပြီ ▁လို့ ▁ လည်း ပဲ ▁ဖော်ပြ ပါတယ် ▁။,ဒေသခံ ရဲ တွေ အဆိုအရ ဇ ူ လို င် ၃ ၁ ရက် နေ့ တနင်္ဂနွေ နေ့ မှာ လူသတ်မှု ဖြစ်ပွား ခဲ့တာ ဖြစ်နိုင် ပြီး အနည်းဆုံး သံသယ ရှိ သူ ၁၀ ယောက် ကို မေးမြန်း ပြီး ပြီ လို့ လည်း ပဲ ဖော်ပြ ပါတယ် ။,ဒေသခံ ရဲ တွေ အဆိုအရ ဇ ူ လို င် ၃ ၁ ရက် နေ့ တနင်္ဂနွေ နေ့ မှာ လူသတ်မှု ဖြစ်ပွား ခဲ့တာ ဖြစ်နိုင် ပြီး အနည်းဆုံး သံသယ ရှိ သူ ၁၀ ယောက် ကို မေးမြန်း ပြီး ပြီ လို့ လည်း ပဲ ဖော်ပြ ပါတယ် ။
False,▁ ဂျ ို နာ ▁ဒ ူ ဒ ူ ရှ ီ ▁ရဲ့ ▁ ခန္ဓာကိုယ် ▁ကို ▁သူမ ▁နေထိုင် ▁ တဲ့ ▁သူမ ရဲ့ ▁အခန်း ▁အ နား ▁မှာ ▁သူမ ရဲ့ ▁လ သား အရွယ် ▁ကလေး ▁နဲ့ ▁တွေ့ ခဲ့ ပါတယ် ▁။,ဂျ ို နာ ဒ ူ ဒ ူ ဒ ူ ရှ ီ ရဲ့ ခန္ဓာကိုယ် ကို သူမ နေထိုင် တဲ့ သူမ ရဲ့ အခန်း အ နား မှာ သူမ ရဲ့ လ သား အရွယ် ကလေး နဲ့ တွေ့ ခဲ့ ပါတယ် ။,ဂျ ို နာ ဒ ူ ဒ ူ ဒ ူ ဒ ူ ဒ ူ ရှ ီ ရဲ့ ခန္ဓာကိုယ် ကို သူမ နေထိုင် တဲ့ သူမ ရဲ့ အခန်း အ နား မှာ သူမ ရဲ့ လ သား အရွယ် ကလေး နဲ့ တွေ့ ခဲ့ ပါတယ် ။
False,▁ နယူး ▁ဟ မ ့် ရှား ▁ကား ▁ပြေး လမ်း ▁မှာ ▁၂၀ ၁ ၀ ▁ လန်း နေ ာ ့ ▁အ င် ဒ တ် စ် ထ ရီ ရယ် ▁ တူး ▁ ၃၀ ၁ ▁အတွင်း ▁ တနင်္ဂနွေ နေ့ ▁မှာ ▁န က်စ် ကာ ▁ တာ တို ▁ဖ လား ▁ ပွဲ စဉ် ▁ဒ ရ ိုင် ဘာ ▁ ဂျ င် မီ ▁ဂျွန် ဆန် ▁ဟာ ▁ ပြိုင်ပွဲ ရာသီ ▁၏ ▁သူ ရဲ့ ▁ဒုတိယ ▁ဆက် တိုက် ▁ ပြိုင်ပွဲ ▁မှာ ▁ အနိုင်ရ ခဲ့ ပါတယ် ▁။,နယူး ဟ မ ့် ရှား ကား ပြေး လမ်း မှာ ၂၀ ၁ ၀ လန်း နေ ာ ့ အ င် ဒ တ် စ် ထ ရီ ရယ် တူး ၃၀ ၁ အတွင်း တနင်္ဂနွေ နေ့ မှာ န က်စ် ကာ တာ တို ဖ လား ပွဲ စဉ် ဒ ရ ိုင် ဘာ ဂျ င် မီ ဂျွန် ဆန် ဟာ ပြိုင်ပွဲ ရာသီ ၏ သူ ရဲ့ ဒုတိယ ဆက် တိုက် ပြိုင်ပွဲ မှာ အနိုင်ရ ခဲ့ ပါတယ် ။,နယူး ဟ မ ့် ရှား ကား ပြေး လမ်း မှာ ၂၀ ၁ ၀ လန်း နေ ာ ့ အ င် ဒ တ် စ် ထ ရီ ရယ် တူး ၃၀ ၁ အတွင်း တနင်္ဂနွေ နေ့ မှာ န က်စ် ကာ တာ တို ဖ လား ပွဲ စဉ် ဒ ရ ိုင် ဘာ ဂျ င် မီ ဂျွန် ဆန် ဟာ ပြိုင်ပွဲ ရာသီ ၏ သူ ရဲ့ ဒုတိယ ဆက် တိုက် ပြိုင်ပွဲ မှာ အနိုင်ရ ခဲ့ ပါတယ် ။
False,▁ယူ အ က်စ် ▁ရဲ့ ▁ရှေ့ ဆောင် ▁အ တတ် ပညာ ဆိုင်ရာ ▁စ တော့ ▁ကား ▁ ပွဲ စဉ် ▁၏ ▁၂၀ ၁ ၀ ▁ ပွဲ ▁မှာ ▁သူ ရဲ့ ▁ငါး ကြိမ် မြောက် ▁အောင်ပွဲ ▁ ဖြစ်ပြီး ▁ အများဆုံး ▁အောင်ပွဲ တွေ ▁အတွက် ▁သူ့ ▁ကို ▁ဒ န် နီ ▁ ဟမ် လင် ▁နဲ့ ▁အဆင့် တူ သွား စေ ပါတယ် ▁။,ယူ အ က်စ် ရဲ့ ရှေ့ ဆောင် အ တတ် ပညာ ဆိုင်ရာ စ တော့ ကား ပွဲ စဉ် ၏ ၂၀ ၁ ၀ ပွဲ မှာ သူ ရဲ့ ငါး ကြိမ် မြောက် အောင်ပွဲ ဖြစ်ပြီး အများဆုံး အောင်ပွဲ တွေ အတွက် သူ့ ကို ဒ န် နီ ဟမ် လင် နဲ့ အဆင့် တူ သွား စေ ပါတယ် ။,ယူ အ က်စ် ရဲ့ ရှေ့ ဆောင် အ တတ် ပညာ ဆိုင်ရာ စ တော့ ကား ပွဲ စဉ် ၏ ၂၀ ၁ ၀ ပွဲ မှာ သူ ရဲ့ ငါး ကြိမ် မြောက် အောင်ပွဲ ဖြစ်ပြီး အများဆုံး အောင်ပွဲ တွေ အတွက် သူ့ ကို ဒ န် နီ ဟမ် လင် နဲ့ အဆင့် တူ သွား စေ ပါတယ် ။
