isNull,original,translated,back_translated
False,▁ပြင်သစ် နိုင်ငံ ▁ပါရီ မြို့ ▁ပါ ့ ဒ က်စ် ▁ပ ရင့် စက် ▁ ၌ ▁၂၀၀ ၇ ခု နှစ် ▁ ရပ် ဘီ ▁ကမ္ဘာ့ ▁ဖ လား ▁တွင် ▁အီတလီ ▁သည် ▁ပေါ်တူဂီ ▁ကို ▁၃ ၁ - ၅ ▁ဂ ိုး ▁ ဖြင့် ▁ရေကူး ကန် ▁ စီ ▁တွင် ▁ရှုံးနိမ့် သွား ပါသည် ▁။,ကမ္ဘာ့ ဖ လား တွင် အီတလီ သည် ပေါ်တူဂီ ကို ၃ ၁ - ၅ ဂ ိုး ဖြင့် ရေကူး ကန် စီ တွင် ရှုံးနိမ့် သွား ပါသည် ။,ကမ္ဘာ့ ဖ လား တွင် အီတလီ သည် ပေါ်တူဂီ ကို ၃ ၁ - ၅ ဂ ိုး ဖြင့် ရေကူး ကန် စီ တွင် ရှုံးနိမ့် သွား ပါသည် ။
False,▁အ န် ဒ ရီ ယာ ▁ မာ စီ ▁သည် ▁အီတလီ ▁အတွက် ▁ စမ်းသပ်မှု ▁တစ်ခု ▁ အဖြစ် ▁စတုတ္ထ ▁မိနစ် ▁တွင် ▁အ မှတ် ပေး ခြင်း ▁ကို ▁ ဖွင့်လှစ် ပေး ခဲ့သည် ▁။,အ န် ဒ ရီ ယာ မာ စီ : အီတလီ အတွက် စမ်းသပ်မှု တစ်ခု အဖြစ် စတုတ္ထ မိနစ် တွင် အ မှတ် ပေး ခြင်း ကို ဖွင့်လှစ် ပေး ခဲ့သည်,အ န် ဒ ရီ ယာ မာ စီ : အီတလီ အတွက် စမ်းသပ်မှု တစ်ခု အဖြစ် စတုတ္ထ မိနစ် တွင် အ မှတ် ပေး ခြင်း ကို ဖွင့်လှစ် ပေး ခဲ့သည်
False,▁ပထမ ▁ တစ်ဝက် ▁၏ ▁ တော်တော်များများ ▁အတွက် ▁ကစား ပွဲ ▁ကို ▁ထိန်းချုပ် ခြင်း ▁မရှိ ခဲ့ လျှင် ▁အီတလီ ▁သည် ▁ ပွဲ နား ချိန် ▁မ တိုင် မှ ီ ▁အခြား ▁မည်သည့် ▁ကြိုးစား မှု ▁ များ ▁ကို မှ ▁အ မှတ် ▁ မရ နိုင် ▁ ပေမယ့် ▁ဒ ေး ဗ စ် ▁ဘ ော် တို လပ် စီ ▁သည် ▁သူတို့ ၏ ▁ဦးဆောင် မှု ▁ကို ▁အ ဓ ွ န့် ရှည် ▁ စေရန် ▁ ပယ် နယ် လ် တီ ▁၃ ဂ ိုး ▁ သွင်း ပေး ခဲ့သည် ▁။,ပထမ တစ်ဝက် ၏ တော်တော်များများ အတွက် ကစား ပွဲ ကို ထိန်းချုပ် ခြင်း မရှိ ခဲ့ လျှင် အီတလီ သည် ပွဲ နား ချိန် မ တိုင် မှ ီ အခြား မည်သည့် ကြိုးစား မှု များ ကို မှ အ မှတ် မရ နိုင် ပေမယ့် ဒ ေး ဗ စ် ဘ ော် တို လပ် စီ သည် သူတို့ ၏ ဦးဆောင် မှု ကို အ ဓ ွ န့် ရှည် စေရန် ပယ် နယ် လ် တီ ၃ ဂ ိုး သွင်း ပေး ခဲ့သည် ။,ပထမ တစ်ဝက် ၏ တော်တော်များများ အတွက် ကစား ပွဲ ကို ထိန်းချုပ် ခြင်း မရှိ ခဲ့ လျှင် အီတလီ သည် ပွဲ နား ချိန် မ တိုင် မှ ီ အခြား မည်သည့် ကြိုးစား မှု များ ကို မှ အ မှတ် မရ နိုင် ပေမယ့် ဒ ေး ဗ စ် ဘ ော် တို လပ် စီ သည် သူတို့ ၏ ဦးဆောင် မှု ကို အ ဓ ွ န့် ရှည် စေရန် ပယ် နယ် လ် တီ ၃ ဂ ိုး သွင်း ပေး ခဲ့သည် ။
False,▁ပေါ်တူဂီ ▁သည် ▁ဘယ်သောအခါမှ ▁စွန့်လွှတ် မှု ▁မရှိ ခဲ့ ▁ ပဲ ▁ဒ ေး ဗ စ် ▁ ပန် နယ် ဗ ါ ▁သည် ▁၃ ၃ ▁မိနစ် ▁တွင် ▁သူတို့ ▁၏ ▁ကစား ပွဲ ▁ရဲ့ ▁အ မှတ် များ ▁ကို သာ ▁အ ထောက် အ ကူ ပြု သည့် ▁ကြိုးစား မှု ▁တစ်ခု ▁မှ ▁အ မှတ် ရ ခဲ့ပါသည်။,ပေါ်တူဂီ သည် ဘယ်သောအခါမှ စွန့်လွှတ် မှု မရှိ ခဲ့ ပဲ ဒ ေး ဗ စ် ပန် နယ် ဗ ါ,ပေါ်တူဂီ သည် ဘယ်သောအခါမှ စွန့်လွှတ် မှု မရှိ ခဲ့ ပဲ
False,▁အီတလီ ▁သည် ▁ပထမ ပိုင်း ▁ ၌ ▁၁ ၆ - ၅ ▁ ဖြင့် ▁ဦးဆောင် ခဲ့ ▁ သော်လည်း ▁ပေါ်တူဂီ ▁မှ ▁ဒုတိယ ပိုင်း ▁ တော်တော်များများ ▁တွင် ▁ဂ ိုး အရေအတွက် ညီ စေ ခဲ့သည် ▁။,အီတလီ သည် ပထမ ပိုင်း ၌ ၁ ၆ - ၅ ဖြင့် ဦးဆောင် ခဲ့ သော်လည်း ပေါ်တူဂီ မှ ဒုတိယ ပိုင်း တော်တော်များများ တွင် ဂ ိုး အရေအတွက် ညီ စေ ခဲ့သည် ။,အီတလီ သည် ပထမ ပိုင်း ၌ ၁ ၆ - ၅ ဖြင့် ဦးဆောင် ခဲ့ သော်လည်း ပေါ်တူဂီ မှ ဒုတိယ ပိုင်း တော်တော်များများ တွင် ဂ ိုး အရေအတွက် ညီ စေ ခဲ့သည် ။
False,▁သို့သော်လည်း ▁ဘ ော် တို လပ် စီ ▁သည် ▁မ ော် ရို ▁ဘာ ဂ မ် မ က် စ ကို ▁၏ ▁ကြိုးစား မှု ▁ များ ▁နှင့် ▁အ န် ဒ ရီ ယာ ▁ မာ စီ ▁၏ ▁ဒုတိယ ဂ ိုး ▁ နောက်ပိုင်း ▁အီတလီ ▁အတွက် ▁အ နိုင် ▁ရရှိ စေရန် ▁သူ၏ ▁စတုတ္ထ မြောက် ▁ကစား ပွဲ ▁၏ ▁ ပယ် နယ် လ် တီ ▁ကို ▁ သွင်း ယူ ပေး ခဲ့သည် ▁။,သို့သော်လည်း ဘ ော် တို လပ် စီ သည် မ ော် ရို ဘာ ဂ မ် မ က် စ ကို ၏ ကြိုးစား မှု များ နှင့် အ န် ဒ ရီ ယာ မာ စီ ၏ ဒုတိယ ဂ ိုး နောက်ပိုင်း အီတလီ အတွက် အ နိုင် ရရှိ စေရန် သူ၏ စတုတ္ထ မြောက် ကစား ပွဲ ၏ ပယ် နယ် လ် တီ ကို သွင်း ယူ ပေး ခဲ့သည် ။,သို့သော်လည်း ဘ ော် တို လပ် စီ သည် မ ော် ရို ဘာ ဂ မ် မ က် စ ကို ၏ ကြိုးစား မှု များ နှင့် အ န် ဒ ရီ ယာ မာ စီ ၏ ဒုတိယ ဂ ိုး နောက်ပိုင်း အီတလီ အတွက် အ နိုင် ရရှိ စေရန် သူ၏ စတုတ္ထ မြောက် ကစား ပွဲ ၏ ပယ် နယ် လ် တီ ကို သွင်း ယူ ပေး ခဲ့ ခဲ့သည် ။
False,▁လောလောဆယ် ▁ရေကူး ကန် ▁ စီ ▁ ၌ ▁ရှစ် မှတ် ▁နှင့် ▁တတိယ ▁ဖြစ် နေသော ▁အီတလီ ▁သည် ▁စက်တင်ဘာ ▁၂ ၉ ▁တွင် ▁ဒုတိယ ▁ရရှိ ထားသော ▁စကော့တလန် ▁နှင့် ▁ခက်ခဲ သော ▁ယှဉ်ပြိုင် မှု ▁တစ်ခု ▁ကို ▁ ရင်ဆိုင်နေရ သည် ▁။,အီတလီ နှင့် ခက်ခဲ သော ယှဉ်ပြိုင် မှု တစ်ခု ကို ရင်ဆိုင်နေရ သည် ။,အီတလီ နှင့် ခက်ခဲ သော ယှဉ်ပြိုင် မှု တစ်ခု ကို
False,▁ နယူး ဇီ လန် ▁သည် ▁ရ မှတ် ▁ ကွာခြား ချက် ▁ အပေါ် ▁စကော့တလန် ▁၏ ▁ရှေ့ မှ ▁ရ မှတ် ▁ဆယ် မှတ် ▁ နှင့်အတူ ▁ အုပ်စု ▁ကို ▁ဦးဆောင် နေ သည် ▁။,နယူး ဇီ လန် သည် ရ မှတ် ကွာခြား ချက် အပေါ် စကော့တလန် ၏ ရှေ့ မှ ရ မှတ် ဆယ် မှတ် နှင့်အတူ အုပ်စု ကို ဦးဆောင် နေ သည်,နယူး ဇီ လန် သည် ရ မှတ် ကွာခြား ချက် အပေါ် စကော့တလန် ၏ ရှေ့ မှ ရ မှတ် ဆယ် မှတ် နှင့်အတူ အုပ်စု ကို ဦးဆောင် နေ သည်
False,▁ပေါ်တူဂီ ▁သည် ▁တစ် မှတ် ▁ရ သော ▁ ရို မေး နီးယား ▁နောက် တွင် ▁အ မှတ် ▁ မရှိဘဲ ▁ အုပ်စု ▁၏ ▁အောက် ဆုံး တွင် ▁ရှိသည်။,ပေါ်တူဂီ သည် တစ် မှတ် ရ သော အုပ်စု ၏ အောက် ဆုံး တွင် ရှိသည်။,ပေါ်တူဂီ သည် တစ် မှတ် သော အုပ်စု ၏ အောက် ဆုံး တွင် ရှိသည်။
False,▁သူတို့ ▁ ယာဉ် မောင်း ▁ လိုင်စင် ▁၏ ▁ သီအိုရီ ▁စာမေးပွဲ ▁အပိုင်း ▁အတွက် ▁ လျှောက် ထား ခဲ့သော ▁ ဗြိတိသျှ ▁သင်ယူ သူ ▁ ယာဉ် မောင်း ▁၃ ▁သန်း ▁၏ ▁ကိုယ် ရေး ▁ အသေးစိတ် များ ▁အချို့ ▁အမေရိကန် ပြည်ထောင်စု ▁ရှိ ▁ အိုင် အို ဝါ ▁တွင် ▁ ပျောက် ဆုံး သွား ခဲ့သည် ▁။,သူတို့ ယာဉ် မောင်း လိုင်စင် ၏ သီအိုရီ စာမေးပွဲ အပိုင်း အတွက် လျှောက် ထား ခဲ့သော ဗြိတိသျှ သင်ယူ သူ ယာဉ် မောင်း ၃ သန်း ၏ ကိုယ် ရေး အသေးစိတ် များ အချို့ အမေရိကန် ပြည်ထောင်စု ရှိ အိုင် အို ဝါ တွင် ပျောက် ဆုံး သွား ခဲ့သည် ။,သူတို့ ယာဉ် မောင်း လိုင်စင် ၏ သီအိုရီ စာမေးပွဲ အပိုင်း အတွက် လျှောက် ထား ခဲ့သော ဗြိတိသျှ သင်ယူ သူ ယာဉ် မောင်း ၃ သန်း ၏ ကိုယ် ရေး အသေးစိတ် များ အချို့ အမေရိကန် ပြည်ထောင်စု ရှိ အိုင် အို ဝါ တွင် ပျောက် ဆုံး သွား ခဲ့သည် ။ ။
False,▁အဆိုပါ ▁ အချက်အလက်များ ▁သည် ▁ဗြိတိန် ▁ မောင်း နှ င် မှု ▁ စံချိန်စံညွှန်း ▁အေဂျင်စီ ▁သို့ ▁ ပုဂ္ဂလိက ▁ ကန် ထ ရိုက် တာ ▁တစ်ခု ▁ ဖြစ်သော ▁ ပီ ယာ ဆ မ် ▁ ယာဉ် မောင်း ဆိုင်ရာ ▁အကဲဖြတ် စ ိ စစ် မှု ▁ လီ မိ တက် ▁က ▁ ပိုင်ဆိုင် ခဲ့သော ▁ဟာ ဒ် ဒ ရိုက် ▁တစ်ခု ▁ ပေါ်တွင် ▁ ပျောက် ဆုံး ခဲ့သည် ▁။,အဆိုပါ အချက်အလက်များ သည် ဗြိတိန် မောင်း နှ င် မှု စံချိန်စံညွှန်း အေဂျင်စီ သို့ ပုဂ္ဂလိက ကန် ထ ရိုက် တာ တစ်ခု ဖြစ်သော ပီ ယာ ဆ မ် ယာဉ် မောင်း ဆိုင်ရာ အကဲဖြတ် စ ိ စစ် မှု လီ မိ တက် က ပိုင်ဆိုင် ခဲ့သော ဟာ ဒ် ဒ ရိုက် တစ်ခု ပေါ်တွင် ပျောက် ဆုံးခဲ့သည် ။,ဗြိတိန် မောင်း နှ င် မှု စံချိန်စံညွှန်း အေဂျင်စီ သို့
False,▁ အသေးစိတ် များ ▁ကို ▁မနေ့က ▁၁ ၇ ၃၀ ▁ယူ တီ စီ ▁ ၌ ▁အောက်လွှတ်တော် ▁ရှိ ▁ဗြိတိန် နိုင်ငံ ▁ ပို့ ဆောင် ရေး ▁အတွင်း ရေးမှူး ▁ ရု သ ် ကယ် လီ ▁က ▁ပေး ခဲ့သည် ▁။,အသေးစိတ် များ ကို မနေ့က ၁ ၇ ၃၀ ယူ တီ စီ ၌ အောက်လွှတ်တော် ရှိ ဗြိတိန် နိုင်ငံ ပို့ ဆောင် ရေး အတွင်း ရေးမှူး ရု သ ် ကယ် လီ က ပေး ခဲ့သည် ။,အသေးစိတ် များ ကို မနေ့က ၁ ၇ ၃၀ ယူ တီ စီ ၌ အောက်လွှတ်တော် ရှိ ဗြိတိန် နိုင်ငံ ပို့ ဆောင် ရေး အတွင်း ရေးမှူး ရု သ ် ကယ် လီ က ပေး ခဲ့သည် ။
False,▁အဆိုပါ ကိစ္စ ▁သည် ▁အောက်တိုဘာလ ▁တွင် ▁လူ ▁၂ ၅ ▁သန်း ▁၏ ▁သတင်းအချက်အလက် များ ▁အခွန် ဝန်ကြီး ဌာန ▁ ကြောင့် ▁ဆုံးရှုံး ခဲ့ ▁ ကတည်းက ▁ဗြိတိန် နိုင်ငံ ▁တွင် ▁ပထမ ဦး ဆုံး သော ▁အဓိက ကျ သည့် ▁ အချက်အလက်များ ▁၏ ▁ ပျောက် ဆုံး မှု ▁ ဖြစ်သည် ▁။,အဆိုပါ ကိစ္စ သည် လူ ၂ ၅ သန်း ၏ သတင်းအချက်အလက် များ အခွန် ဝန်ကြီး ဌာန ကြောင့် ဆုံးရှုံး ခဲ့ ကတည်းက ဗြိတိန် နိုင်ငံ တွင် ပထမ ဦး ဆုံး သော အဓိက ကျ သည့် အချက်အလက်များ ၏ ပျောက် ဆုံး မှု ဖြစ်သည် ။,အဆိုပါ ကိစ္စ သည် ဗြိတိန် နိုင်ငံ တွင် ပထမ ဦး ဆုံး သော အဓိက ကျ သည့် အချက်အလက်များ ၏ ပျောက် ဆုံး မှု ဖြစ်သည် ။
False,▁ လွှတ်တော်အမတ် များ ▁သို့ ▁သူမ၏ ▁ ကြေငြာ ချက် ▁တွင် ▁ ရု သ ် ကယ် လီ ▁က ▁ ပျောက် ဆုံး ခဲ့သော ▁ အချက်အလက်များ ▁အတွင်း ▁မည်သည့် ▁ဘ ဏ် လုပ်ငန်း ▁သတင်းအချက်အလက် ▁မှ ▁မ ပါ ၀င် ▁ သကဲ့သို့ ▁တစ်ဦးချင်း စီ ▁၏ ▁ မွေး သ က ္ က ရာ ဇ် များ ▁ လည်း ▁မ ပါ ၀င် ကြောင်း ▁အတည်ပြု သွား ခဲ့သည် ▁။,လွှတ်တော်အမတ် များ သို့ သူမ၏ ကြေငြာ ချက် တွင် ရု သ ် ကယ် လီ က ပျောက် ဆုံး ခဲ့သော အချက်အလက်များ အတွင်း မည်သည့် ဘ ဏ် လုပ်ငန်း သတင်းအချက်အလက် မှ မ ပါ ၀င် သကဲ့သို့ တစ်ဦးချင်း စီ ၏ မွေး သ က ္ က ရာ ဇ် များ လည်း မ ပါ ၀င် ကြောင်း အတည်ပြု သွား ခဲ့သည် ။,လွှတ်တော်အမတ် များ သို့ သူမ၏ ကြေငြာ ချက် တွင် ရု သ ် ကယ် လီ က ပျောက် ဆုံး ခဲ့သော အချက်အလက်များ အတွင်း မည်သည့် ဘ ဏ် လုပ်ငန်း သတင်းအချက်အလက် မှ မ ပါ ၀င် သကဲ့သို့ တစ်ဦးချင်း စီ ၏ မွေး သ က ္ က ရာ ဇ် များ လည်း မ ပါ ၀င် ကြောင်း အတည်ပြု သွား ခဲ့သည် ။
False,▁သူမ ▁သည် ▁လုံခြုံရေး ရာ ▁ဆောင်ရွက် မှုများ ▁ ရယူ ခဲ့ကြောင်း ▁နှင့် ▁သိမ်းဆည်းထား ခဲ့သော ▁သတင်းအချက်အလက် များ ▁သည် ▁စ ံ သတ်မှတ်ထား သော ▁နည်းလမ်း များ ▁ ဖြင့် ▁ “ ▁အလွယ်တကူ ▁ အသုံး ဝင် သော ▁သို့မဟုတ် ▁ ဖတ် ရှု ခွင့် ရ သော ▁” ▁ ပုံစံ ▁တစ်ခု ▁ အနေဖြင့် ▁ မဟုတ် ကြောင်း ▁မီး မောင်း ထိုး ပြ ခဲ့သည် ▁။,သူမ သည် လုံခြုံရေး ရာ ဆောင်ရွက် မှုများ ရယူ ခဲ့ကြောင်း နှင့် သိမ်းဆည်းထား ခဲ့သော သတင်းအချက်အလက် များ သည် စ ံ သတ်မှတ်ထား သော နည်းလမ်း များ ဖြင့် “ အလွယ်တကူ အသုံး ဝင် သော သို့မဟုတ် ဖတ် ရှု ခွင့် ရ သော ” ပုံစံ တစ်ခု အနေဖြင့် မဟုတ် ကြောင်း မီး မောင်း ထိုး ပြ ခဲ့သည် ။ ။,သူမ သည် လုံခြုံရေး ရာ ဆောင်ရွက် မှုများ ရယူ ခဲ့ကြောင်း နှင့် သိမ်းဆည်းထား ခဲ့သော သတင်းအချက်အလက် များ သည် စ ံ သတ်မှတ်ထား သော နည်းလမ်း များ ဖြင့် “ အလွယ်တကူ အသုံး ဝင် သော သို့မဟုတ် ဖတ် ရှု ခွင့် ရ သော ” ပုံစံ တစ်ခု အနေဖြင့် မဟုတ် ကြောင်း မီး မောင်း ထိုး ပြ ခဲ့သည် ။ ။
False,▁ဗြိတိန် ▁တွင် ▁ဤ ▁ အချက်အလက်များ ▁၏ ▁ တိကျ သည့် ▁ဆုံးရှုံး မှုများ ▁နှင့် ▁အစိုးရ ▁၏ ▁သတင်းအချက်အလက် များ ▁ လုံခြုံ စိတ် ချ စွာ ▁စုဆောင်း ▁ပြီး ▁ထိန်းသိမ်းထား ရှိ ▁ နိုင်စွမ်း သော ▁ သဘောသဘာဝ ▁ နှစ်ခု စလုံး ▁နှင့် ▁ပတ်သက်၍ ▁နိုင်ငံရေး အရ ▁ သုံးသပ် မှုများ ▁ဆက်လက် ▁ မြှင့် တက် နေ ခဲ့သည် ▁။,ဗြိတိန် တွင် ဤ အချက်အလက်များ ၏ တိကျ သည့် ဆုံးရှုံး မှုများ နှင့် အစိုးရ ၏ သတင်းအချက်အလက် များ လုံခြုံ စိတ် ချ စွာ စုဆောင်း ပြီး ထိန်းသိမ်းထား ရှိ နိုင်စွမ်း သော သဘောသဘာဝ နှစ်ခု စလုံး နှင့် ပတ်သက်၍ နိုင်ငံရေး အရ သုံးသပ် မှုများ ဆက်လက် မြှင့် တက် နေ ခဲ့သည် ။ ။,ဗြိတိန် တွင် ဤ အချက်အလက်များ ၏ တိကျ သည့် ဆုံးရှုံး မှုများ နှင့် အစိုးရ ၏ သတင်းအချက်အလက် များ လုံခြုံ စိတ် ချ စွာ စုဆောင်း ပြီး ထိန်းသိမ်းထား ရှိ နိုင်စွမ်း သော သဘော ရှိ ခဲ့ သည် ။ ။
False,▁လစ်ဘရယ် ▁ဒီမိုကရက် ▁ကို ▁ကိုယ်စားပြု ထားသော ▁ ဆူ ဇ န် ▁က ရာ မား ▁က ▁ “ ▁ အချက်အလက်များ ▁စုဆောင်း ▁ ရန် ▁၊ ▁ အချက်အလက်များ ▁ပိုမို ▁ရရှိ ▁ ရန် ▁၊ ▁သင့် ▁အကြောင်း ▁ပိုမို ▁သိရှိ ▁ ရန် ▁၊ ▁ထို မှတဆင့် ▁အတူတကွ ▁ပိုမို ▁ဆက်သွယ် ▁ ရန် ▁ဤ ကဲ့သို့ ▁စဉ်ဆက်မပြတ် ▁ကြိုးစား မှု ▁သည် ▁အားလုံး ▁ကို ▁နောက်ထပ် ▁ ထည့်သွင်းစဉ်းစား ခြင်း ▁သို့မဟုတ် ▁ဆွေးနွေး မှု ▁တစ်ခု ▁ ဖြစ်ကြောင်း ▁ကျွန်ုပ် ▁ထင်မြင် သည် ▁” ▁ဟု ▁တင်ပြ သွား ခဲ့သည် ▁။,လစ်ဘရယ် ဒီမိုကရက် ကို ကိုယ်စားပြု ထားသော ဆူ ဇ န် က ရာ မား က “ အချက်အလက်များ စုဆောင်း ရန် ၊ အချက်အလက်များ ပိုမို ရရှိ ရန် ၊ သင့် အကြောင်း ပိုမို သိရှိ ရန် ၊ ထို မှတဆင့် အတူတကွ ပိုမို ဆက်သွယ် ရန် ဤ ကဲ့သို့ စဉ်ဆက်မပြတ် ကြိုးစား မှု သည် အားလုံး ကို နောက်ထပ် ထည့်သွင်းစဉ်းစား ခြင်း သို့မဟုတ် ဆွေးနွေး မှု တစ်ခု ဖြစ်ကြောင်း ကျွန်ုပ် ထင်မြင် သည် ” ဟု တင်ပြ သွား ခဲ့သည် ။,လစ်ဘရယ် ဒီမိုကရက် ကို ကိုယ်စားပြု ထားသော ဆူ ဇ န် က ရာ မား က “ အချက်အလက်များ စုဆောင်း ရန် ၊ အချက်အလက်များ ပိုမို ရရှိ ရန် ၊ သင့် အကြောင်း ပိုမို သိရှိ ရန် ၊ ထို မှတဆင့် အတူတကွ ပိုမို ဆက်သွယ် ရန် ဤ ကဲ့သို့ စဉ်ဆက်မပြတ် ကြိုးစား မှု သည် အားလုံး ကို နောက်ထပ် ထည့်သွင်းစဉ်းစား ခြင်း သို့မဟုတ် ဆွေးနွေး မှု တစ်ခု ဖြစ်ကြောင်း ကျွန်ုပ် ထင်မြင် သည် ” ဟု တင်ပြ သွား ခဲ့သည် ။
